{
  "$schema": "https://json-schema.org/draft/2020-12/schema",
  "$id": "https://petal-panic.local/macros/macro.schema.json",
  "title": "Petal Panic Level Macro",
  "description": "Contract for one macros/levels/<id>.json file. Geometry uses positive whole-unit dimensions; placement-specific area bounds and playability are enforced by validateLayout().",
  "type": "object",
  "additionalProperties": false,
  "required": [
    "id",
    "name",
    "orientation",
    "difficulty",
    "units",
    "placements",
    "variations",
    "follows",
    "followedBy",
    "schemaVersion"
  ],
  "properties": {
    "schemaVersion": {
      "description": "Macro data format version. Current = \"square-grid-v1\" (48×48 square grid; horizontal fields in cells). Legacy files without this marker are rejected by the runtime and must be migrated offline via tools/migrate_square_grid.mjs.",
      "const": "square-grid-v1"
    },
    "id": {
      "type": "string",
      "pattern": "^[A-Za-z0-9_]+$",
      "minLength": 1
    },
    "name": {
      "type": "string",
      "minLength": 1
    },
    "orientation": {
      "type": "string",
      "enum": ["horizontal", "vertical"]
    },
    "difficulty": {
      "type": "integer",
      "minimum": 1,
      "maximum": 3
    },
    "units": {
      "type": "array",
      "minItems": 1,
      "items": {
        "oneOf": [
          { "$ref": "#/$defs/block" },
          { "$ref": "#/$defs/platform" }
        ]
      }
    },
    "placements": {
      "type": "array",
      "items": { "$ref": "#/$defs/placement" }
    },
    "variations": {
      "type": "array",
      "description": "Reserved for generated/authored variants. Empty in v1; object entries remain forward-compatible.",
      "items": {
        "type": "object",
        "additionalProperties": true
      }
    },
    "follows": {
      "type": "array",
      "uniqueItems": true,
      "items": { "$ref": "#/$defs/macroId" }
    },
    "followedBy": {
      "type": "array",
      "uniqueItems": true,
      "items": { "$ref": "#/$defs/macroId" }
    },
    "clearance": {
      "type": "object",
      "description": "Editor ghost-test proof for the exact macro content signature. Removed automatically when content changes.",
      "additionalProperties": false,
      "required": ["status", "contentSignature"],
      "properties": {
        "status": { "const": "cleared" },
        "contentSignature": {
          "type": "string",
          "pattern": "^[0-9a-f]{8}$"
        }
      }
    }
  },
  "$defs": {
    "macroId": {
      "type": "string",
      "pattern": "^[A-Za-z0-9_]+$",
      "minLength": 1
    },
    "gridCoordinate": {
      "type": "integer",
      "minimum": 0
    },
    "positiveUnits": {
      "type": "integer",
      "minimum": 1
    },
    "blockWidthCells": {
      "description": "Block width in cells: a positive multiple of the 2-cell block column (agreed rules). Block x is also on the 2-cell lattice; both are enforced by the runtime validator.",
      "type": "integer",
      "minimum": 2,
      "multipleOf": 2
    },
    "block": {
      "type": "object",
      "additionalProperties": false,
      "required": ["kind", "x", "y", "width", "height"],
      "properties": {
        "kind": { "const": "block" },
        "x": { "$ref": "#/$defs/gridCoordinate" },
        "y": { "$ref": "#/$defs/gridCoordinate" },
        "width": { "$ref": "#/$defs/blockWidthCells" },
        "height": { "$ref": "#/$defs/positiveUnits" }
      }
    },
    "platform": {
      "type": "object",
      "additionalProperties": false,
      "required": ["kind", "x", "y", "width"],
      "properties": {
        "kind": { "const": "platform" },
        "x": { "$ref": "#/$defs/gridCoordinate" },
        "y": { "$ref": "#/$defs/positiveUnits" },
        "width": { "$ref": "#/$defs/positiveUnits" }
      }
    },
    "placement": {
      "type": "object",
      "additionalProperties": false,
      "required": ["slot", "type", "x", "y"],
      "properties": {
        "slot": {
          "type": "string",
          "minLength": 1
        },
        "type": {
          "type": "string",
          "enum": ["enemy", "barrel", "powerup"]
        },
        "x": { "$ref": "#/$defs/gridCoordinate" },
        "y": { "$ref": "#/$defs/gridCoordinate" }
      }
    }
  }
}
